NodeType,PatchManagementSummary,PatchManagementReceivedDateTime,PatchManagementID,PatchManagementTitle
[PatchManagement],Blog post updates: * 8/15: Added a link to the process of installing updates on management tools machine when there are no Exchange servers running. * 8/15: Temporarily removed all download links.,2023-08-16T00:54:13+00:00,815ec15c-fffc-a872-0cd9-15022639061c,Exchange - what a disaster this month
[PatchManagement],"To protect against CVE-2023-44487, you should install the latest Windows update. You can also set the limit of the RST_STREAMS per minute using the new registry keys in this update.",2023-10-10T17:25:42+00:00,ad29321a-5c4f-be9d-1ab4-5b52beee6b79,DDOS - and registry keys
[PatchManagement],"The organization is experiencing crashes in an old visual foxpro app after upgrading PCs to Win 11 22H2. The faulting .dll is msvcr71.dll, which is an old file. The organization has tried installing various c libraries from MS but the file is not found. The vendor suspects a Defender P2 issue. The organization is looking for a list of dll's MS publishes with the latest/last known good version.",2023-05-03T16:16:51+00:00,eea81abb-dd4a-ef1d-84c0-9eb61226762d,Finding newer Microsoft .dll for VFP app
[PatchManagement],"The user is experiencing an issue with Autodesk Inventor 2022 when using the Windows Key + K to display wirelessly to a TV or monitor. This problem has occurred within the past month or two, despite no recent changes to the Inventor patches. The user is inquiring if anyone has experienced similar issues with Windows Updates causing problems with Autodesk Inventor 2022.",2023-04-27T18:38:05+00:00,12fe4f8f-8eb9-91da-d33b-0e65d7164f59,Autodesk Inventor 2022 and Windows Key + K Wireless Display Issue
[PatchManagement],"The user is running Config Manager 2111 and is not receiving any updates for Office 2016, despite the fact that there are updates available for April. The user has checked the Config Manager and WSUS logs and found no errors. The issue is specific to Office 2016 as updates for other products are being received.",2023-04-21T02:27:07+00:00,98638612-08f0-f978-384d-fe465998a808,Configuration manager missing the latest Office updates
[PatchManagement],"A solution has been provided for the issue of 2012 Server R2 Monthly Roll-Ups not installing. The solution involves applying the March SSU (KB5023790) for 2012 R2, and then applying the CU for July.",2023-07-14T17:26:34+00:00,2b19cb4a-0c24-4afb-cae5-e5a5faabf46c,2012 Server R2 Monthly Roll-Ups Not Installing
[PatchManagement],"BIOS updates are essential to keep systems up-to-date with the latest security patches. AMD has entered the BIOS update party with the Zenbleed attack, which leaks sensitive data from AMD Zen2 processors. It is recommended to apply any BIOS updates as soon as they become available.",2023-07-31T17:36:39+00:00,de7b85d8-8013-1c5c-fba5-969befb93c50,BIOS updates are pure fun 🥳
[PatchManagement],Dcom hardening was enforced in March and the author is inquiring about the impact. A Powershell tool is shared to help identify impacted software.,2023-04-07T01:18:39+00:00,27839661-679d-70f6-0b24-bcbb8cf8c1a0,Dcom hardening enforced in March - how's the dead body count?
[PatchManagement],The user reports that dictation is not working across several devices after the latest update. This issue is observed with the Hololens app using Unity's DictationRecognizer and also with the virtual keyboard. The user suspects it to be a system issue.,2023-04-20T04:04:24+00:00,cc710710-27c9-0a2e-7375-0b87d3e57440,FYI Dictation not working with Windows 10 - not related to windows update
[PatchManagement],A problem has been reported where two systems experienced a BSOD after the latest Google Chrome update was deployed to the test group.,2023-04-07T14:10:41+00:00,99dd6439-d005-70a9-3541-ce64ca941507,BSOD and Google Chrome 112.0.5615.50 Update
[PatchManagement],The email discusses the release of June 2023 Exchange Server Security Updates. The provided link leads to the official Microsoft Exchange Team Blog where the updates can be found.,2023-06-15T05:15:13+00:00,dccdc0e8-4b7d-6fa1-dd44-33f2b198c91d,Exchange Updates out this month
[PatchManagement],"The email discusses the issue of fake Windows updates and provides a link to an article about the 'Big Head' ransomware. The email is from Bruce P., a System Administrator at a regional bank.",2023-07-11T15:32:15+00:00,1bd73071-d985-aa35-2485-dbe95f1004a0,Fake Windows Updates
[PatchManagement],"Check My Operator (3CX) is a tool that allows users to identify if they were potentially impacted by the supply chain attack against 3CX from March 2023. If the background appears in red, the IP address you are visiting this site from was flagged by security researchers as potentially impacted. This site is a best effort to broadly notify potential impacted parties of this attack by members of the cyber security research community.",2023-03-31T22:56:33+00:00,cc7de40c-4571-f2f9-7a39-9dd7cdfbad21,Check My Operator (3CX)
[PatchManagement],"The update doesn't apply because the option is rolled into the OS on Win11. The registry key has the same impact, though. The 'EnableCertPaddingCheck' ability exists in all currently supported (and patched) versions of Windows now, but remains (and will probably always remain) disabled by default.",2023-04-07T01:18:39+00:00,3a91ad65-e914-247e-8027-67bf50f7a291,3CX hack targeted 10yo vulnerability
[PatchManagement],This email discusses the impact of CVE-2023-44487 on web servers and provides solutions to protect against it. The solutions involve installing the latest Windows update and setting the limit of the RST_STREAMS per minute using new registry keys. It also mentions workarounds and the option to disable the HTTP/2 protocol on the web server.,2023-10-11T04:43:41+00:00,005b04b7-c04a-5f1b-6a89-62b3824555ee,CVE-2023-44487 HTTP/2 Rapid Reset Attack
[PatchManagement],"About half of the servers are showing errors in wsus, failed defender updates. All are up to date with February patches. Manually running update gets to about 66% and then error 0x80070643. Versions that show failed in the log are 1.383.1311, 1321, 1335, 1345, 1361 and 1379. Server 2016, 19 and 22 are all affected, but not all of each version. SFC /scannow shows no corruption. Tried running the latest mpam-fe.exe from MS, no help. Reboot no help.",2023-03-09T23:54:40+00:00,fa21d213-7e90-1bf3-2b5a-c06f04f18bf3,Defender errors
[PatchManagement],The user is managing multiple domains without any trust relationship between them. They have deployed a KMS Server running Windows Server 2019 Standard edition in domainA.local. The user wants to know how to activate from another domain and whether a KMS key should activate all previous versions of windows.,2023-07-04T07:15:57+00:00,80d3bcbd-c435-ff8c-aa41-cd9ce97c1ce3,KMS across multiple forests
[PatchManagement],"After a recent update, the Windows Mail app is rebranded as 'Outlook Pre' and replaces the Outlook 365 icons and shortcuts. Opening 'Outlook Pre' disables Outlook from MS 365. Trying to repair MS 365 from the control panel removes MS 365 completely. Reinstalling MS 365 from office.com is the only solution, but it is a painful process in rural areas with slow internet connections.",2023-05-11T19:16:45+00:00,23208f64-89eb-a235-9b01-9cb36b7af57e,MS 365 & Outlook issues
[PatchManagement],"A user reports an issue where Microsoft Edge 114.0.1823.55 in WSUS is marked as expired when approved, despite being shown as current on the Microsoft Edge release notes for Stable Channel. The user is seeking information on why this is happening.",2023-06-20T20:56:14+00:00,011a92a2-8b3d-f0dc-eaa9-f9c03fc8b49f,IE expired
[PatchManagement],This post discusses the use of Proactive Remediation & Configuration Items to address the security vulnerability CVE-2023-24932. The details can be found in the GARYTOWN ConfigMgr Blog.,2023-05-11T04:31:27+00:00,8c2dc454-350c-a89e-0e51-39117e1a93c4,KB5025885: Dealing with CVE-2023-24932 via Proactive Remediation & Configuration Items
[PatchManagement],"It is Patch Tuesday once again. The CISA KEV database is now up to 925 CVEs and at the rate it is increasing it is likely we will see it turn over the 1k mark around lates August this year. Apple has released a new capability called Rapid Security Responses for iOS, iPad, and macOS. For systems running the latest version of each, they will start to receive faster responses to security vulnerabilities, security improvements, and mitigations. Microsoft has resolved a total of 51 vulnerabilities, 13 of which were previously released and recently updated. There are three known exploited vulnerabilities resolved this month, one of which was previously released and recently updated. There is one additional publicly disclosed vulnerability that has reached proof-of-concept code maturity meaning the risk of exploit is high. Six CVEs are rated as Critical, five affecting the Windows OS and one affecting Sharepoint. The good news this month is all three known exploited and the public disclosure along with five of the six Critical CVEs will be resolved by pushing the Microsoft OS updates this month.",2023-05-09T19:58:58+00:00,51b8ce07-332e-c48a-2c73-3d8a8b833347,Ivanti's patch commentary
[PatchManagement],"A user reports that recent patches have caused virtual network adapters to fail on Hyper-V clustered virtual machines. The issue is observed on Server 2012-R2 instances but not on Server 2019 instances. The user also reports a separate issue on a personal machine running Windows 11, where an update to the your-phone service failed, causing the Windows Event Log to write at 60MBps to the C drive due to a full backing file of the event log.",2023-06-14T19:04:36+00:00,1b51a45d-4ac6-1f75-fe16-0eeab036ad05,HyperV - virtual network adapter impact - June patching
[PatchManagement],"Microsoft has released July 2023 quality updates. The Patch Tuesday warns of 6 zero-days, 132 flaws. An update ring in Intune is in place, but not all devices are up to date. The user is seeking a way to expedite the update and is concerned about the potential impact.",2023-07-16T16:30:39+00:00,8b6410f2-1a2b-a160-50a8-5a03f7c270ac,Expediting - July 2023 Patch Tuesday Updates
[PatchManagement],"The email discusses new enhancements to Windows 11, including the Windows 365 Boot, Bluetooth Low Energy Audio, and glanceable VPN. It also mentions ongoing improvements to Windows 11 Enterprise and the tools used to deploy, update, and manage it effectively. The email introduces the concept of organizational messages, a way to deliver targeted, branded, and personalized call-to-action to a specific group of employees via native Windows 11 surfaces. It also discusses the new Autopatch groups capability and the ability to delegate the rollout of Windows 11 feature updates using Windows Autopatch. The email concludes with a mention of the collaboration with device manufacturers to provide certified and validated drivers, and the availability of the Windows Autopatch preview.",2023-05-23T21:41:39+00:00,67c2f18b-99e8-8fdb-4897-522b31ec6edd,Expanding IT value in Windows 11 Enterprise and Intune
[PatchManagement],The solution provided involves the use of registry keys and a system restart. More information can be found in the provided Microsoft security advisory link.,2023-04-07T21:19:32+00:00,a09545d1-c002-3e87-5083-7c0bc268ed8d,3CX hack targeted 10yo vulnerability
[PatchManagement],The patch KB5022835 for IE 11 on 2012 R2 Server is not applicable due to the addition of the ESU component to eliminate Windows 8.1. The 2022-10 SSU is a prerequisite for the 2023-02 & 2023-03 updates. The 2023-03 SSU KB5023790 or later will become prerequisite for the 2023-08 updates.,2023-03-17T23:12:09+00:00,29b7225e-c95f-63c8-e552-6666e3b7c3f4,KB5022835 (IE 11 for 2012 R2 Server) Not Applicable?
[PatchManagement],"The user upgraded a client to server 2022 and rolled out a new WSUS server. While checking the categories, the user accidentally clicked on the Drivers checkbox. This resulted in over 700k updates pending approval/rejection and an SQL database of approximately 54Gb. The user found thousands of identical copies of the same drivers and the WSUS server became almost unusable. The user had to remove WSUS and reinstall it.",2023-08-08T09:38:49+00:00,2f226fb0-52e8-a8ac-cd8e-0020167706b4,New WSUS server - accidentally checked the drivers checkbox
[PatchManagement],Several PCs at multiple clients are not detecting the feature update despite the target being set in the registry. The issue persists even after a restart. Other updates are detected and installed. The user is seeking suggestions for a remote/command line approach to resolve the issue.,2023-04-05T18:21:36+00:00,3df754a0-5de4-1f14-b337-678d4367ca4e,Not detecting 22H2 Feature Update with target set
[PatchManagement],This post is related to patch management as changes come with CUs. It refers to a must-have lecture and Edge Collection / Favorites to check.,2023-04-28T13:36:19+00:00,3fb10414-086d-76ee-1adb-72e48f822bda,Microsoft Monthly Timebombs reddit
[PatchManagement],"The email discusses a 3CX hack that targeted a 10-year-old vulnerability. The author raises a concern about the assumption that 'the key to configure' is present on all Windows 11 devices, especially those that were either clean installed or upgraded from Windows 10.",2023-04-09T00:47:50+00:00,43dff152-a52c-9010-54cd-fd61efda1cac,3CX hack targeted 10yo vulnerability
[PatchManagement],"Upgrading to Windows 11 resets other policies and removes keys related to channel preference and privacy controls. The particular key is removed during upgrade because Microsoft may be using apps that rely on writing to the padding area or wants to ensure that any third-party install triggers from an upgrade don't fail. The key doesn't have to already exist within the registry to configure it. Setting the key imposes the check. Imposing the check, however, has zero effect other than removing the digital signatures tab for most people. Other security applications or settings must also be assigned in order to prevent these apps from actually running.",2023-04-09T17:05:59+00:00,a49f787e-c4af-0ae4-c0be-2e8660aeb3d8,3CX hack targeted 10yo vulnerability
[PatchManagement],The user is experiencing an issue where the update KB5022835 for IE 11 on a Windows 2012 R2 Server is showing as 'not applicable' for installation. The user has IE 11 installed with a recent update. The user also tried to apply the Feb SSU for 2012 Server (KB5022923; NOT R2) but it failed. The user is seeking understanding of why this KB won't install.,2023-03-17T14:40:58+00:00,c36f63dc-088e-e30a-3b44-5e86de91376f,KB5022835 (IE 11 for 2012 R2 Server) Not Applicable?
[PatchManagement],The user reports an issue with the spell check feature in Microsoft Teams after the latest update.,2023-08-09T14:43:57+00:00,5c0046b7-636b-faac-18f2-e3c9ddeaa7a0,MSteams Spell check broken
[PatchManagement],This email provides a link to the latest Windows hardening guidance and key dates.,2023-05-12T16:30:51+00:00,31aea500-1a55-8945-6018-196d055686bf,Latest hardening info
[PatchManagement],"Clients with Defender ATP installed are experiencing slowdowns, particularly with HTTP/s requests delayed by up to 30 seconds. The issue is suspected to be related to the web filtering of Defender. Enabling troubleshooting mode and disabling network protection with Set-MpPreference -EnableNetworkProtection AuditMode seems to temporarily resolve the issue.",2023-04-14T16:22:05+00:00,2bb6fb2e-3e76-af93-8e4d-17e9288fcf41,Intermittent Network Connectivity Issues
[PatchManagement],"Today's Patch Tuesday: 39 vulnerabilities resolved by Microsoft, five critical, and two zero-days. In addition, important third-party updates include Google Chrome, Apache, Service Location Protocol, VMware, Android, Apple, Intel, Linux and others. A webinar is hosted for details and discussions. The digest explains the most serious vulnerabilities in popular Windows software that have been patched over the past month. Protect your systems from potential cyber threats and ensure the smooth functioning of your endpoints.",2023-05-09T17:41:17+00:00,eb897b22-e549-8549-bde1-9414ccc4065c,May 2023 Patch Tuesday Digest by Action1
[PatchManagement],The patch KB5025221 on Windows 10 v21H2 is causing a black screen issue post logon. The issue is resolved after two reboot cycles.,2023-04-14T16:51:18+00:00,285569da-fed2-a191-d271-0236eb0a6f47,KB5025221 on Windows 10 v21H2
[PatchManagement],"The key to configure behavior is available to assign on Windows 11 without having to install the Windows 10/8/7 security update (KB2915720). It doesn't really do much other than prevent 'validation' of the certificate, but if you're using a security platform that requires certificate validation for executables then it will report it as being unsigned.",2023-04-08T14:10:55+00:00,fb97b2f2-4779-9c95-e54a-c28070cfff89,3CX hack targeted 10yo vulnerability
[PatchManagement],The solution involves assigning registry keys and rebooting. No installation or import is required. The specific registry keys to be set are: HKLM\Software\Microsoft\Cryptography\Wintrust\Config\EnableCertPaddingCheck with a value of 1 and HKLM\Software\Wow6432Node\Microsoft\Cryptography\Wintrust\Config\EnableCertPaddingCheck with a value of 1.,2023-04-07T21:32:10+00:00,b6edc470-cd61-d5ba-45b4-2998d196c3c5,3CX hack targeted 10yo vulnerability
[PatchManagement],"The email raises a concern about the quality of proofreading in a Microsoft KB article. Specifically, it points out a misspelling in the section '3b Apply the Secure Boot UEFI Forbibben List (DBX)' of KB5025885. The author questions the overall quality control of the steps, recommendations, and the patch itself.",2023-05-10T05:35:33+00:00,2bc63b4c-74ec-7462-50e4-2a6d766ca7de,Microsoft - can we get some better proofreading on this KB?
[PatchManagement],"The email discusses the need for a patching tool that can run scripts post install. The current process involves manual steps and a reboot, which is not ideal for real world implementation. The author mentions Shavlik as a tool that could automate this process in the past and asks if Ivanti or other patching tools have similar capabilities.",2023-05-10T20:09:01+00:00,4380e080-fe62-8b6a-69d7-bba49ab0ee13,Is there any patching tool that can run scripts post install?
[PatchManagement],"IT admins are invited to register for a webinar on Wednesday, May 24 to learn about the new features in Windows release health information experiences. The webinar will cover how to access information to better manage updates, reduce potential support cases, and improve productivity.",2023-05-23T05:34:22+00:00,411ea54b-e0b4-94eb-3f4f-98eb4bc53b42,"IT admins, register for our webinar on Wednesday, May 24"
[PatchManagement],The client is using a Tenable (Nessus) scanner and found a High finding on a MS server. The server is running .NET core 6.0.8 and asp.net core 6.0.8. The user is unsure if the latest Security Updates for Microsoft .NET core (April 2023) and Security Updates for Microsoft ASP.NET Core (February 2023) are sufficient to address the finding.,2023-04-24T15:17:46+00:00,b6aac06b-ef6b-a854-c9bb-8f5deb68fcd3,Microsoft .NET core and  ASP.NET Core on MS 2016 / 2019 Server
[PatchManagement],"The email discusses a 10-year-old vulnerability that has been targeted in a 3CX hack. The vulnerability is suggested to have been rolled into the OS, potentially adding registry keys with a disabled value. However, on a small sample of Win11 22H2 devices fully updated with the latest Mar. 2023 updates, those registry keys are not always present.",2023-04-08T03:07:14+00:00,381baf50-1998-f42a-f8f1-d50ac9dc10f6,3CX hack targeted 10yo vulnerability
[PatchManagement],"Microsoft has resolved a record number of vulnerabilities this year - 142 vulnerabilities in total, six of them are zero-days and nine criticals. A quick review of important third-party vulnerabilities including issues found in MOVEit, Firefox, Android, Cisco, Microsoft Teams, Linux, ChatGPT, FortiGate, VMware and Apple. Microsoft has released a significant number of updates, addressing a total of 142 vulnerabilities. This includes 132 new fixes and updates for 10 previously addressed issues, resulting in a record-breaking number of fixes for the year. Among these, there are nine critical vulnerabilities that have been resolved, along with an update for an older critical vulnerability. This month’s updates also cover six zero-day vulnerabilities, with one of them publicly disclosed, and an update for a previously patched zero-day.",2023-07-11T17:38:40+00:00,0d395fc8-aa0f-4488-00c3-59f1a962b465,July Patch Tuesday and Third-Party App Vulns - Analysis by Action1
[PatchManagement],The post discusses an expected issue after updates if you use Windows Hello. The issue is described as an OOBE like 'pop'.,2023-06-14T16:50:21+00:00,581a9667-9f4a-48c7-a256-7b8672abfb21,If you use Windows Hello
[PatchManagement],"The use of KMS via KMS Server is not recommended unless necessary. Networking requirements and the use of unsupported versions are factors to consider. ADBA per Domain is suggested as an alternative, along with central management using VAMT.",2023-07-08T16:25:50+00:00,6c2ce963-304a-20b6-11ed-a36483e96602,KMS across multiple forests
[PatchManagement],"The email discusses the challenge of managing updates for Per-User based applications, such as Zoom, which are often hidden from traditional update solutions. The author questions whether to force the uninstall of these Per-User installs in order to deploy easily updatable MSI installations across the entire organization.",2023-03-30T19:48:17+00:00,997d74f3-74bf-dec6-90fd-07874d8fcdee,Keeping Per-User Based Applications Current
[PatchManagement],"After the Microsoft June update is applied and the system reboots, there are issues with opening Google Chrome.",2023-06-27T14:01:59+00:00,568cf4f7-e720-8596-e63d-43933f6651d0,MS June Cumulative Update causes GOOGLE CHROME issues
[PatchManagement],A hotpatch is now available for Windows Server virtual machines on Azure with Desktop Experience. This patch is designed to improve the performance and stability of the system.,2023-04-13T00:54:47+00:00,b647e7ba-1e2d-8e08-a208-de88b1c553bd,Hotpatch now available for Windows Server VMs on Azure with DE
[PatchManagement],"Today's Patch Tuesday: 86 vulnerabilities resolved by Microsoft, 9 critical, including CVSS 9.8 in MS Office. Also included is the monthly summary of other critical vulnerabilities: Intel, TPM 2.0, Google Chrome, Jenkins, Veeam, and Android. Quick summary below, full details here: https://www.action1.com/patch-tuesday-march-2023/",2023-03-14T17:43:11+00:00,ec7b8d5b-41ad-e9e1-6d5e-39539f5f7f26,March Patch Tuesday Summary by Action1
[PatchManagement],The email provides a link to a MOVEit Transfer Critical Vulnerability advisory.,2023-06-01T21:36:47+00:00,23c0b581-4812-d4ff-0565-ffe23b1c07bc,MOVEit advisory
[PatchManagement],The post discusses group policy issues that have arisen after the installation of KB5025221 on managed Windows clients. Several reports have been made regarding this issue.,2023-04-14T16:23:05+00:00,d247f9c5-636d-e4a6-b46e-5e4562067c8d,Group policy issues with this month?
[PatchManagement],"IT admins are invited to register for a webinar on Wednesday, May 24 to learn about the new features in Windows release health information experiences. The webinar will cover how to access information to better manage updates, reduce potential support cases, and improve productivity.",2023-05-23T05:34:22+00:00,ddea1a68-0f5e-150b-9484-3439d00322bb,"IT admins, register for our webinar on Wednesday, May 24"
[PatchManagement],"This month's patch includes resolutions for multiple zero-day exploits by Microsoft, operational changes for Kerberos and Netlogon, and a large lineup of third-party updates. The changes in Kerberos and Netlogon are being phased in due to their impact on core authentication mechanisms. Microsoft has also resolved 130 net new vulnerabilities this month and there are updates to 9 previously released CVEs. Six CVEs and one Advisory have confirmed exploits. Microsoft has updated CVE-2023-24932, which is a Security Feature Bypass in Secure Boot. The CVE was originally resolved in May 2023, but Microsoft has expanded the affected OS versions and is recommending customers update to the July update on all affected Windows OS version this month. The vulnerability has confirmed exploits in the wild. Microsoft has resolved a Security Feature Bypass in Azure Active Directory. Microsoft has resolved a Security Feature Bypass in Microsoft Outlook. Microsoft has resolved a Remote Code Execution vulnerability in Office and Windows HTML. Microsoft has resolved an Elevation of Privilege vulnerability in Windows Error Reporting. Microsoft has resolved a Security Feature Bypass in Azure Active Directory. Microsoft has resolved a Security Feature Bypass in Microsoft Outlook. Microsoft has resolved a Remote Code Execution vulnerability in Office and Windows HTML. Microsoft has resolved an Elevation of Privilege vulnerability in Windows Error Reporting.",2023-07-11T20:45:33+00:00,7dcf039f-14dc-dae9-824a-fd22732222df,Ivanti patch commentary
[PatchManagement],"The user has stopped receiving CISA email alerts and weekly vulnerability summaries. The last vulnerability summary was received on March 8, and the last alert was dated April 6. The user has resubscribed to some alerts but is still not receiving vulnerability summaries. The user is inquiring if others have also stopped receiving these emails or if CISA has announced a change in their email policy.",2023-04-26T16:41:32+00:00,9dec6aab-a727-1528-a7c7-74a9d0b7a6fc,Has CISA gone quiet??
