NodeType,PatchManagementSummary,PatchManagementReceivedDateTime,PatchManagementID,PatchManagementTitle
[PatchManagement],"The 2023-10 Monthly Rollup KB5031419 and Security Only KB5031407 contain an update to sppsvc component, which add support for ESU MAK addon. If your ESU key didn't allow ESU updates installation next month, then you probably need KB5031419 or KB5031407.",2023-10-11T04:37:11+00:00,701a4e86-6f16-5101-d57a-b26434b068c2,End of support Server 2012
[PatchManagement],"After the last Chrome update, some users experienced missing profiles. For logged in profiles, the solution is to click the profile icon and sign back in. For non-signed in users, the following locations should be checked for the missing profile.",2023-10-12T22:07:02+00:00,9678acc6-e04d-bcc0-b2cf-8a92792a3940,Post October Updates Missing Chrome profile
[PatchManagement],"The issue is interpreted as patching the hyper-v host triggering the issue. The plan is to patch VMs, not the hosts, until a real resolution is available. There is a Veeam forum posting about a Microsoft 'fix' for an RCT issue.",2023-10-19T00:19:06+00:00,329b0cc9-6550-f925-60ad-4fb8e4924eec,October patches
[PatchManagement],"A problem was encountered with the boot manager after a Windows Update. The issue was traced to a faulty entry in the BCD store. The solution involved removing the BCD store and using bootrec /rebuildbcd to install a fresh copy, which resolved the problem.",2023-09-19T02:45:33+00:00,57ce5346-8fd2-24e7-0e65-786608d09c8d,Boot manager failure after August updates
[PatchManagement],"The email discusses the benefits of using a patch management solution, specifically Action1. The tool is set to look for updates daily and can be configured to either ask for approval or automatically run the update. Action1 also includes a vulnerability scanner that alerts the user to any CVE alerts for software on the computer, with suggestions for fixes. The email emphasizes the time-saving benefits of using such a tool.",2023-10-02T17:36:37+00:00,39008ab6-a9f1-897c-8a07-9f6fa2b05d11,CVE-2023-4863 - libwebp
[PatchManagement],"A script is used to check for a new version of libwebp, download it, package it, and deploy it.",2023-10-02T15:05:39+00:00,e1dcc95e-4511-31bf-dc37-63992beca75e,CVE-2023-4863 - libwebp
[PatchManagement],Known issues for the Copilot in Windows preview have been identified. These include problems with the Narrator and chat input box. Microsoft is working on a resolution.,2023-09-26T17:33:51+00:00,6851c25a-ce78-7f49-c4ee-bd0290d87059,Copilot released in the OPTIONAL updates today
[PatchManagement],The email provides a list of apps affected by the 0 day vulnerability in libwebp. The vulnerability is further detailed in a link provided.,2023-10-02T17:10:11+00:00,162215a5-1240-e30c-b5f1-eca58743184a,CVE-2023-4863 - libwebp
[PatchManagement],The email provides a tool for managing deployment of the new Teams client.,2023-10-24T16:48:40+00:00,be53b11e-3ac4-6bcb-ecd3-ddcbecc4553b,Updating New Teams
[PatchManagement],The email discusses the announcement that Windows 7 and 8 will no longer be upgradable to Windows 10. This change will impact the installation path for free Windows 7 and 8 upgrades.,2023-10-27T09:08:58+00:00,a2c2ba61-2198-c686-61ff-f8f397b2df25,Win 7 no longer upgrading to Win10 - no more reinstalling PCs
[PatchManagement],The email provides a solution for a Windows 11 upgrade issue. The solution involves deleting certain staging folders and restarting the Windows Update service.,2023-10-25T18:36:14+00:00,22ba5fbe-09c1-e468-1d0d-b157f192a292,Windows 11 upgrade
[PatchManagement],The email provides a workaround to prevent Windows 11 upgrade and interrupt an in-process upgrade to Windows 11. It involves a registry addition that sets a 'target version' of Windows. This prevents Windows 11 and any future attempts to upgrade. The workaround can be easily modified or removed to resume the normal upgrade process. The added values can also be deleted to allow the normal upgrade process to resume if you later decide you are ready for Windows 11.,2023-10-26T02:27:05+00:00,022a987e-f54d-657a-308f-2f512b5cefdf,Windows 11 upgrade
[PatchManagement],"To block Windows 11 upgrade, you can disable the TPM chip in BIOS. This makes your machine incompatible with Windows 11 and the upgrade won't be offered. You can re-enable the TPM chip when you are ready to upgrade to Windows 11.",2023-10-26T12:16:15+00:00,aab95f90-1268-ed1e-deaf-001999553c8d,Windows 11 upgrade
[PatchManagement],A package is available in WSUS for upgrading to W10 22H2. The exact title of the package is not recalled but will be provided shortly.,2023-09-21T14:41:36+00:00,df269915-377a-c700-4c24-5f68a3804a91,Wsus and approving Win 11 21H2 -> 22H2 upgrade
[PatchManagement],"The '2023-10 Cumulative Update for Microsoft server operating system version 21H2 for x64-based Systems' (KB5031364) causes previous versions of AuthLite to break on 2022 Domain Controllers. The issue can be resolved by installing AuthLite 2.4.14 or newer on the DCs. If the update has already been applied and login is not possible, a workaround involves renaming the file CSALsubauth.dll and then installing the new version of AuthLite.",2023-10-13T23:03:37+00:00,139df8a9-4477-506f-39f5-103fb6f8b9e9,"AUTHLITE ANNOUNCE: Install 2.4.14 (or later) on DCs, to prevent 2023-10 Windows Update issue"
[PatchManagement],The author has created a container in WSUS and added the computers they want the update applied to. This is a solution provided for managing the upgrade from Windows 11 21H2 to 22H2.,2023-09-25T17:47:31+00:00,f2ab42e6-fbc6-77dd-183f-ad0586747b86,Wsus and approving Win 11 21H2 -> 22H2 upgrade
[PatchManagement],"Security updates are available for Adobe Bridge, Adobe Commerce, and Adobe Photoshop. More details can be found on the Adobe Security website.",2023-10-10T17:32:53+00:00,9d45f6c6-782e-5ffb-cc14-673d5223e609,Adobe Security Bulletin
[PatchManagement],"The user is experiencing issues with installing KB890830 on Windows Server 2019. The installation completes without any error, but the tool does not install. The user has tried various scripts but to no avail. All other Windows updates are installed and the system is fully updated.",2023-10-29T12:16:10+00:00,57217e70-b3b3-edd5-46aa-767e25e7b715,Windows Malicious Software Removal Tool x64 - v5.118 (KB890830)  Unable to install on Server 2019
[PatchManagement],"If you already had Digital License (AKA Hardware ID activation) due upgrading from Windows 7/8/8.1 or using genuine Windows 7/8/8.1 key, it will continue to work whenever you reinstall Windows 10/11 on the same machine/hardware however, since September 26 2023, if you perform new upgrade from Windows 7/8/8.1 or used Windows 7/8/8.1 key to activate Windows 10/11, it will not work or grant new Digital License.",2023-10-26T04:02:57+00:00,41948ae2-57cf-9b96-0625-c90784b0ff80,Win 7 no longer upgrading to Win10 - no more reinstalling PCs
[PatchManagement],The email provides a tool that can be helpful for Windows 11 upgrade.,2023-10-26T13:31:22+00:00,0f3a88fd-8bcb-59b9-c778-39c4924371cc,Windows 11 upgrade
[PatchManagement],Local Accounts upgraded from Win7 to Win10 store the digital license on MSFT’s server. The license for that specific device is the determining factor for a reinstall of Win10 on the same device. Both Microsoft Accts(MSA) and Local Accounts are digitally licensed. Use of an MSA links the device to that account and offers an additional feature not available in a Local Account.,2023-10-26T02:27:06+00:00,75fc2045-0902-cf7b-ea09-e4bf73049df3,Win 7 no longer upgrading to Win10 - no more reinstalling PCs
[PatchManagement],A client's profile issue was fixed by removing McAfee from the machine. The issue was likely caused by antivirus interference with the boot process. It is suggested to contact McAfee for further assistance.,2023-10-25T22:38:39+00:00,121df3d4-e2cb-1dab-b2a9-a843e621b5c7,The User Profile Service failed the sign in. User profile cannot be loaded
[PatchManagement],The email discusses a slipstream method for images that has been working flawlessly to slip drivers in. It mentions the use of Vista x64 drivers in some RD Farms at accounting firms. The email also talks about ways to get drivers to behave and the importance of testing. The clients are said to solely source with the sender or go with the products recommended by them. The sender emphasizes the cost to productivity and the effort to make unapproved products work.,2023-10-25T18:36:20+00:00,277b7119-f59c-80b2-f36b-3065c783d191,Microsoft stop messing with my people's task bar settings.
[PatchManagement],Microsoft has stopped permitting reactivation of PCs running Windows 10 which has been upgraded from Windows 7 after reinstallation. This affects the upgrade to Windows 10 on these machines.,2023-10-25T11:09:27+00:00,43cf8985-c351-9e59-fd66-780749538e5e,Win 7 no longer upgrading to Win10 - no more reinstalling PCs
[PatchManagement],*nix machines running in VMware need updated: Local Privilege Escalation and SAML Token Signature Bypass,2023-10-27T19:45:02+00:00,e1cca042-9ce7-0ac1-27ba-8720b48b1546,New CVEs for open-vm-tools
[PatchManagement],The Windows Malicious Software Removal Tool x64 - v5.118 (KB890830) is unable to install on Server 2019. The solution involves checking the exit code of the .exe. Exit codes are listed on the Microsoft support page.,2023-10-29T19:07:07+00:00,133144a9-0c8f-503a-c4ed-30795bb97a86,Windows Malicious Software Removal Tool x64 - v5.118 (KB890830) Unable to install on Server 2019
[PatchManagement],"Since October 18, 20% of our PCs have the error: “The User Profile Service failed the sign in. User profile cannot be loaded”. Many TEMP.{DOMAIN NAME}.000 folders are seen in C:\Users\. Users are able to log in after several reboots. Actions taken include verification of Regedit, automatic start of the service, SCF + DISM, uninstalling KB5031356, and creation of a new profile.",2023-10-25T18:36:06+00:00,1742286f-5583-c547-8243-8ba70cf1ebfd,The User Profile Service failed the sign in. User profile cannot be loaded
[PatchManagement],"The issue is observed on a test Hyper-V host running Windows Server 2019. The problem is not related to Veeam, but to Microsoft's own replication with Azure Site Recovery. Deleting only the RCT files seems to have resolved the issue for the affected guests.",2023-10-27T14:51:54+00:00,836a7418-0c15-a5cf-ed86-3d1cb4d7f1a6,October patches
[PatchManagement],The email discusses a tool found on Reddit related to an issue with distribution points after an upgrade from 2207 to 2211 in SCCM.,2023-11-10T09:38:08+00:00,455213ac-918e-ecd8-5e1b-89db3d125bc6,Do you look at update logs?
[PatchManagement],"The email provides a solution for managing the update version 23H2 of Windows 11. The solution involves downloading the ISOs, waiting for the month's LCU, and then servicing the WIM as per normal.",2023-11-02T02:40:29+00:00,169f42ef-8ec6-a403-1cba-b2b7fe57ef12,23H2 being dribbled out on Windows update
[PatchManagement],The email provides links to the Windows 11 23H2 Enablement Package. These links are useful for system administrators looking to update their systems to the latest version of Windows 11.,2023-11-01T19:43:03+00:00,b1e58fe1-e507-42ad-f638-93d33d738bdf,Windows 11 23H2 Enablement Package Location
[PatchManagement],"The email discusses the use of cmtrace as a helpful tool for managing updates. It mentions that update logs can point to potential fixes, but when they don't, it can lead to the need for Windows repair, especially on a server.",2023-11-09T12:42:44+00:00,14baa765-2e46-4fa2-4b8e-f4d1d5edbc1a,Do you look at update logs?
[PatchManagement],"This is likely due to the October update. In the last couple of weeks, there have been increasing numbers of machines running Windows 10 where the netlogon service fails to start, citing a dependent service failure. This is due to the dependency in the chain netlogon.",2023-11-03T10:24:12+00:00,2dde10c4-80fc-366a-6cc4-c1801594d17d,Issue with Windows 10 and the netlogon/lanmanworkstation services not starting
[PatchManagement],"If you’re updating devices that are already running Windows 11, version 22H2, you can use an enablement package for a fast, easy installation process.",2023-11-01T18:57:11+00:00,0f3b45d4-b3a4-0cc0-24bb-1a3332c93c89,Windows 11 23H2 Enablement Package Location
[PatchManagement],The organization is in the pilot phase of updating Microsoft Teams. They have encountered issues with the Teams Outlook add-in not loading for some users and the date format on Teams messages being in US format instead of Australian. The organization plans to go live in the next month.,2023-10-24T02:53:03+00:00,9685af6c-9528-c62e-8bcf-b23c8526e7b0,Updating New Teams
[PatchManagement],"A user on Windows 10 Pro 22H2 accepted a pushed offer from Microsoft to install Win 11 22H2, despite having selected 'stay on Win 10' in the past. The machine is currently waiting at the 'pending restart' message. The administrator does not want this machine on Windows 11 and is seeking a solution to reverse this action without finishing the Win 11 install with a restart and then having to uninstall.",2023-10-25T14:04:16+00:00,6950b207-a419-d88b-a7d4-033c617e38a1,Windows 11 upgrade
[PatchManagement],The user has updated their SCCM to 2211 and is experiencing issues. The client check is failing and the user is seeking advice on how to fix the problem.,2023-11-10T09:27:16+00:00,9e87a138-20c0-01a9-228d-7f1b08c3b003,Do you look at update logs?
[PatchManagement],"Delve into the universe Microsoft's security & patch updates with PatchaPalooza, for streamlined vulnerability management. Using Microsoft's MSRC CVRF API, this tool caters exclusively to cybersecurity professionals, bringing forth an intuitive interface that delivers essential insights without overwhelming users with tech jargon.",2023-11-08T17:58:31+00:00,d1752fa0-f7bf-7a1f-6448-69b02d4bdf5c,PatchaPalooza
[PatchManagement],"The email provides a solution for receiving security updates after the end of extended support for Server 2012. It includes the installation of KB5031419, KB5032308, and KB5017220, as well as the restart of the wuauserv service and a rescan for updates.",2023-11-16T15:26:40+00:00,f64ec20d-6790-fbb9-daee-2097c72cccea,End of support Server 2012
[PatchManagement],The email discusses the slow performance of the WSUS 23H2 installer when used to upgrade older versions of Windows. It also mentions the issue of the WSUS released 23H2 patch not applying to any hardware that isn't officially supported by Windows 11. The author suggests manual upgrade methods for unsupported Windows 11 boxes.,2023-11-16T16:26:55+00:00,349f45b9-962f-e3b7-f9e0-5b18083a24cd,WSUS missing KB5027397 Windows 11 23H2 Enablement Package
[PatchManagement],"A recent WebKit update is causing issues with Enterprise Single Sign On (SSO) for Microsoft 365 services. The update affects Microsoft 365 suite and may lead to SSO failures on Mac and iOS devices. The issue is due to a software update to iOS, iPadOS, and macOS that included a version of WebKit with code regressions impacting the functionality of the Microsoft Enterprise SSO Plug-in. The impact is specific to iOS/iPadOS 17.1.x and MacOS 14.1.x. Admins are advised to evaluate upgrading to these versions carefully and may want to postpone upgrading until a resolution is available from Apple. Intune can be used to prevent operating system version updates for devices under management.",2023-11-11T02:01:15+00:00,d250a978-356e-0149-ba7e-7e73236b254c,We've detected a recent WebKit update which may impact Enterprise Single Sign On (SSO) for Microsoft 365 services
[PatchManagement],The solution involves using REG.exe to add registry keys that disable WindowsCopilot and Edge's HubsSidebar. The WindowsCopilot key is added to 'HKLM\Software\Policies\Microsoft\Windows\WindowsCopilot' with the value 'TurnOffWindowsCopilot' set to 1. The Edge key is added to 'HKLM\SOFTWARE\Policies\Microsoft\Edge' with the value 'HubsSidebarEnabled' set to 0.,2023-11-18T09:54:33+00:00,e508a88a-dbc9-43ee-a9d3-21d319158b1a,Windows 10 will be able to join in the fun of Copilot
[PatchManagement],"The email provides a solution for a patch management issue. The solution involves stopping the Windows Update and Bits services, deleting the staging folders, and then configuring the Product Version and Target version in the registry or GPO. The device needs to be restarted after these steps.",2023-11-01T09:47:20+00:00,6ff2cc72-f237-f9fe-587e-8203a308d30a,WSUS: New Update(s) Alert From WSUS
[PatchManagement],The email discusses the 20th anniversary of Patch Tuesday and invites thoughts on what Microsoft should do next.,2023-11-03T22:36:28+00:00,867b1857-61fa-3755-af0f-618e2d1de345,End of the week thoughts - what are your thoughts on 20 years of Patch Tuesday?
[PatchManagement],The author discusses the use of WU logs and PowerShell code to extract download links of Appx applications. This is done as an alternative to using httpX://store.rg-adguard.net/ which the author does not trust due to its association with 2 .ru websites.,2023-11-08T18:02:18+00:00,0d1aadf5-7bf4-5a27-bf53-3de6c9fee90b,Do you look at update logs?
[PatchManagement],"The email discusses a Server-Side Request Forgery (SSRF) vulnerability, specifically ZDI-CAN-22101 – CreateAttachmentFromURI Server-Side Request Forgery. The attack scenario involves an attacker authenticating to OWA, creating a new draft message, invoking CreateAttachmentFromUri, triggering the SSRF, and then downloading the attachment and retrieving the response content.",2023-11-08T03:01:35+00:00,76fcd96d-3e81-34e0-5ae6-15c963320e68,ZDI-CAN-22101 - CreateAttachmentFromURI Server-Side Request Forgery
[PatchManagement],The issue is with the GPO ADMX suggesting a wrong formatting for the account to fetch the password. This prevents Windows LAPS from being deployed. The issue has been identified and a fix is provided.,2023-11-02T18:26:36+00:00,c60fe673-ac9e-68fc-5101-72bafc59b1e0,Windows LAPS on-premises issue and fix
[PatchManagement],"The email discusses the introduction of a new app called Dev Home in Windows 11. It also mentions the new Outlook on Windows, which is available for free on any Windows device. Additionally, it notes that Chat is now Microsoft Teams (free1) and is pinned by default to the taskbar.",2023-11-17T20:38:04+00:00,31320d43-ccb5-98bf-3a20-27808fdc3d12,There is a new app called Dev Home in Windows 11.
[PatchManagement],This email discusses the continuous innovation in Windows 10. It provides a tool for support and further information.,2023-11-17T12:36:08+00:00,d20dc2cd-6dff-f510-77c2-c0534d8eb68f,Windows 10 will be able to join in the fun of Copilot
[PatchManagement],This post discusses a tool that allows Windows 10 to join in the fun of Copilot. The tool is a feature update for Windows 10.,2023-11-17T14:01:16+00:00,251a414e-693e-37db-a20b-2f983a4afa5a,Windows 10 will be able to join in the fun of Copilot
[PatchManagement],The email provides a solution for enabling the feature 'Microsoft-Windows-TS-OptionalComponents-Package' in the 'Windows Features' window.,2023-11-16T16:34:29+00:00,a29aa418-3011-9f8d-9690-63683d0eca4b,Remote Desktop in CPL?
[PatchManagement],A change has been documented regarding the installation of Remote Desktop Connection as a feature in Windows 10 22H2 Preview Update KB5031445. This change was rolled out globally in November 2023.,2023-11-17T04:52:25+00:00,82d0ed30-ff03-7793-111c-63aae18f6887,Remote Desktop in CPL?
[PatchManagement],The user is experiencing issues with the Remote Desktop App downloaded from the app store not working across dual monitors. The user is aware that the 'use all monitors' setting can be used in the mstsc connection but cannot find a way to get the Store app to use dual monitors.,2023-11-17T16:10:48+00:00,4cae9c19-c06d-fc36-6ad8-830696c17354,Remote Desktop in CPL?
[PatchManagement],"The email discusses the challenges of keeping systems updated, particularly with all updates from 2015 forward on refreshed or new systems. The author mentions the use of OSDupdate and PowerShell to pull down all applicable updates and repackage Office 2016 for new or re-imaged devices. The email also mentions the use of manual installation and the placement of .msp files in the updates folder for initial install. The author emphasizes the importance of reviewing and setting up the system. A reliable internal source stated that the lack of new roll-ups or service packs for Office 2016 was by design to encourage the use of M365 and click to run technologies with regular new base builds.",2023-11-16T18:06:25+00:00,d191e3f6-4d6d-e3d3-5337-1d2fd947be28,Office 2016 Patching
[PatchManagement],"The user is looking for a way to detect whether a PC has Acrobat or Reader installed, as they use the same program name. They are specifically looking for a registry value to differentiate between the two.",2023-11-17T22:32:12+00:00,bfd4e49f-622c-b123-350d-14a8365c6331,Detecting whether PC has Acrobat or Reader
[PatchManagement],The email discusses how to detect whether Acrobat or Acrobat Reader is installed on a PC by looking for specific executable files and their locations. It also mentions that the two programs store settings in different registry keys.,2023-11-18T03:30:30+00:00,8f31f1e6-761d-268c-467f-25a14f3a603b,Detecting whether PC has Acrobat or Reader
[PatchManagement],"The email provides a solution for errors encountered while installing Win11 KB5032190. The suggested solutions involve upgrading to the next version via ISO or performing an in-place upgrade via ISO. The latter option installs 22H2 over the existing version and behaves like a feature update, removing and reinstalling Windows but keeping all programs and profiles.",2023-11-17T15:18:01+00:00,d51b3480-8c48-d660-d1f5-449af2cc320b,Errors Installing Win11 KB5032190
[PatchManagement],"The email provides download links for Office 2016 updates for both x64 and x86 systems. These updates include the latest security and non-security updates. The updates are necessary for all Product suites, including Professional, Pro Plus, Standard, and Home Business. Even if the programs are not chosen to install, their updates contain needed files or patch applicability rules that are targeted against suites MSI ProductCode.",2023-11-16T19:47:54+00:00,cdb88a68-d0b9-9236-344f-2b750cfc3bad,Office 2016 Patching
[PatchManagement],Microsoft's investigation of Storm-0558's attack revealed that a consumer signing system crash in April 2021 led to the leakage of the MSA key into a crash dump. This dump was later moved to the company's internet-connected corporate debugging environment. The key was found by threat actors who compromised a Microsoft engineer's corporate account. The key was then used to access enterprise mail. The issue has been corrected.,2023-09-06T18:41:36+00:00,6fa7c65e-cd8a-17c8-7b1d-9edf30c0685f,OT: The key was stolen from a crash dump
[PatchManagement],"The email discusses an issue reported to Microsoft that is related to an unsupported processor. The problem is suspected to be an interaction with the patch, although the patch itself may not be the direct cause of the issue.",2023-08-26T02:30:39+00:00,4cd5e813-1a70-52e3-194e-8828540ca32f,Microsoft received reports about an 'UNSUPPORTED_PROC...
[PatchManagement],The email discusses the end of the servicing plan for third-party printer drivers on Windows. It provides a link to the Microsoft Learn page for more information.,2023-09-07T06:01:07+00:00,0f7fd0b6-f6bc-d49b-4c3a-0b34341c709a,End of servicing plan for third-party printer drivers on Windows - Windows drivers | Microsoft Learn
[PatchManagement],The user installed the preview CU for Windows 10 22H2 and found that the Windows backup app was installed with KB5029331. They have turned it off but would have preferred to be given the choice.,2023-09-07T06:50:45+00:00,1f1c6d78-2035-2e68-e947-8db7102c9940,Heads-up - Windows backup app installed with KB5029331 (and presumably next CU)
[PatchManagement],"The email discusses a project that allows sniffing of Bitlocker keys, reinforcing the idea that without physical security, there is no computer security.",2023-09-12T15:49:02+00:00,ed9a4738-5301-5ca1-e089-012bd60d7b07,Bitlocker keys are able to be sniffed from the TPM
[PatchManagement],"The user expresses disappointment in the rollout of Edge for Business, particularly its impact on end users and the lack of management tools. The user suggests that the rollout should have been less intrusive and that management capabilities should have been available from the start. The user also criticizes the forced nature of the update and its impact on end users.",2023-08-26T18:09:36+00:00,56c075c9-3286-b537-8e83-c90d16ec2de3,Feedback to the Edge team
[PatchManagement],The new Edge for Business has automatically appeared on some systems after recent Edge updates. Microsoft has announced that signing into Edge using Azure Active Directory will automatically transition you to Edge for Business. The new Edge for Business icon will have a briefcase to designate that you are in the work browser window. This change was not widely publicized before it was pushed.,2023-08-23T20:07:20+00:00,fd77d8a7-7df4-cd83-e759-6458213a382c,Edge For Business Rebrand Pushing Out to Users
[PatchManagement],"The email discusses mitigations for the dangers of some of the latest published vulnerabilities, particularly focusing on the implications of CVE-2023-36761. It emphasizes the importance of blocking SMB from leaving your networks to prevent sending your hash to the Internet.",2023-09-13T17:16:45+00:00,fcb48cc1-cc78-12f7-f622-7c964b2a6d6f,CVE-2023-36761
