NodeType,PatchManagementSummary,PatchManagementReceivedDateTime,PatchManagementID,PatchManagementTitle
[PatchManagement],The email discusses an issue where BitLocker might incorrectly show a 65000 error in the 'Require Device Encryption' setting. This issue is a reporting issue only and does not affect drive encryption or the reporting of other issues on the device. The affected platforms include various versions of Windows 10 and 11. The email provides a workaround to mitigate the issue in Microsoft Intune and mentions that a resolution is being worked on.,2023-10-09T22:56:31+00:00,ca7d2239-1194-f1f6-fd31-33839ca71d40,BitLocker might incorrectly receive a 65000 error in ...
[PatchManagement],A solution has been provided for an issue where starting virtual machines may fail after the installation of the October 2023 cumulative update.,2023-10-22T20:21:30+00:00,d375bfbf-e9cb-754c-900e-2f7aab79bef8,October patches
[PatchManagement],The email discusses a CVE vulnerability related to libwebp. The author is seeking more information about the vulnerability and its risk level. The internal Cyber team has recommended prioritizing the patching or update for Chrome and Edge browsers.,2023-10-02T11:23:35+00:00,56ea7876-6251-109c-1b98-12ece3b45e11,CVE-2023-4863 - libwebp
[PatchManagement],"A user reported that when trying to copy a range in Excel 2016 on Windows 11 22H2, the application hangs and the memory consumed keeps increasing. The issue is not resolved by removing the W11 22H2 Sept. updates. The problem is found to be related to the OS. The cause is identified as Excel 2016 behaving differently in 22H2 than in 21H2, particularly when working with frozen rows and copying filtered columns.",2023-09-21T17:08:46+00:00,f2c7d35e-b0af-55df-d85c-e99ea831ceea,Excel 2016 64bit - Excel 2016 behaves differently in 22H2 than it does in 21H2
[PatchManagement],"This email provides a summary of the October Patch Tuesday. It includes details of vulnerabilities and updates for various products including Microsoft, Google Chrome, Firefox, Apple, Linux, Atlassian, Progress Software WS_FTP, Jet Brains Team City, Exim, Cisco, Nagios, and Kubernetes. The email also discusses the critical vulnerabilities and zero-day vulnerabilities addressed by Microsoft. It further explains the zero-day vulnerability found in the libvpx library of Google Chrome and the critical libwebp vulnerability. The email also covers the critical vulnerability in the libwebp library of Mozilla Firefox and the three zero-day vulnerabilities of Apple. The email concludes with a discussion on the critical vulnerabilities in the Progress Software WS_FTP, Jet Brains Team City, Exim, Cisco, Nagios, and Kubernetes.",2023-10-10T18:16:50+00:00,65ecee37-ea07-61fa-5e32-7b84ccb2822a,October Patch Tuesday Analysis by Action1
[PatchManagement],"After patching servers with the September patches, the Curl vulnerability is still seen in Tenable. It is not recommended to manually update the Curl utility embedded in Windows Server. The recommendation is to have it updated by a Microsoft patch. The query is whether Microsoft included an update for Curl within this month's patches or will they have one next month.",2023-09-30T03:02:41+00:00,e3b62895-cc79-6508-5369-fa8a6c49cf02,Curl update
[PatchManagement],Copilot in Windows will start to release in preview to select global markets as part of our latest update to Windows 11. The initial markets for the Copilot in Windows preview include North America and parts of Asia and South America. Commercial and education customers can use a new policy to control optional updates in Windows 11.,2023-09-26T17:19:45+00:00,d2444d1b-ec7f-4552-234f-b1243c06a84c,Copilot released in the OPTIONAL updates today
[PatchManagement],"This email discusses a blog post from the Windows IT Pro Blog that focuses on enhancing Windows 11 security, accessibility, and management for enterprises.",2023-09-27T04:51:44+00:00,b978c462-af6d-d656-92fc-fa911cbf74d8,"Enhancing Windows 11 security, accessibility, and management for enterprises"
[PatchManagement],"A few machines have reported that Office update KB5002457 is breaking Outlook. Uninstalling the KB seems to fix it, but the issue reoccurs if the update reinstalls. The user is looking for a more substantial fix.",2023-09-21T16:06:14+00:00,d886c058-ffbe-1efe-c8ba-9a2524fa7bb7,KB5002457 - Breaking Outlook
[PatchManagement],"The email discusses the need to enforce channel binding for LDAP on domain controllers. It identifies that many devices and software, such as HP and Xerox printers, Barracuda web content filter, and McAfee ePo, are using LDAP and may need to be updated to support the new binding or use LDAPS with a certificate. The email also mentions the default behavior of Win10 and Server 2012/2016 systems to use the new binding. It queries the need for explicit creation of the LdapEnforceChannelBindings registry entry after the patch with the LDAP changes is applied.",2023-10-03T14:27:58+00:00,bbb7c46a-65d1-3fd8-eac6-0f219a44bfad,LDAP Security: LdapEnforceChannelBinding
[PatchManagement],"A user reports that their non-business devices running M365 Family (Current Channel, non-Insider) updated to Version 2309 (Build 16287.20080). However, the program settings only show release notes for Version 2308 and do not display 2309 or the Desktop versions. The user notes that to find the Version 2309 ‘Release notes’ for Current Channel Desktop versions, one must drill down further on the same linked page to the M365 Insider Program/Release Notes Current Channel (Preview).",2023-09-25T22:09:20+00:00,2c315922-e421-231c-469b-4f89ed46aac8,Microsoft 365 Office - Consumer Desktop version Release Notes
[PatchManagement],The email discusses the upcoming changes to NTLM and the need to prepare for its eventual retirement. It provides a link to a Microsoft blog post that explains the evolution of Windows authentication.,2023-10-11T18:12:14+00:00,68a6e2dd-ab1f-0e49-a7e5-16010f7ecbd4,NTLM - prepare for it's demise
[PatchManagement],A WSUS deployment with Win11 22H2 clients was not receiving updates despite patches being approved. The issue was resolved by enabling the 'scan source policies' in group policy and ensuring they were all set to WSUS. This enabled the clients to pick up the October updates. The 'dual scan' feature is now a requirement for WSUS. Another fix is to ensure the UseUpdateClassPolicySource is being set. Scan Source policies are the intended method for controlling the update source.,2023-10-16T06:38:41+00:00,ede057a0-dd10-feb8-c5e1-d391dcea99db,Got win11 22H2 and WSUS and not seeing october updates?
[PatchManagement],The email provides links to the latest Server 2016 and 2019 SSU (Servicing Stack Update). These updates are important for the smooth functioning and security of the server systems.,2023-09-20T18:24:43+00:00,4e25f090-e8b1-ea18-8a63-b0d30ebe8b03,Latest Server 2016 and 2019 SSU Links
[PatchManagement],"Microsoft stop messing with my people's task bar settings. Search is back with a 'people' link on desktops where they had disabled search after the October updates. To remove the search box from the taskbar in Windows 10, you can follow these steps: 1. Right-click on an empty space on the taskbar. 2. Select Taskbar settings. 3. Scroll down to the Taskbar items section. 4. Toggle the switch next to Search to Off.",2023-10-11T17:28:24+00:00,c9a2f2ba-d46b-974a-a1ca-6d660968783d,Microsoft stop messing with my people's task bar settings.
[PatchManagement],HP computers not on BIOS released after September can get stuck in a boot loop and need a new motherboard. The issue is suspected to be caused by the October Cumulative Update (CU). The scale of the issue and the specific KB causing it are not clear. The administrator is seeking information from the community to assess the potential impact on their 800 HP computers.,2023-10-18T13:28:02+00:00,25e05e23-5619-70f4-dd5f-5f2aaca319ec,October CU and HP motherboards
[PatchManagement],"The email discusses the installation of CoPilot through different updates. It mentions that the September 26, 2023—KB5030310 (OS Build 22621.2361) Preview does not install CoPilot, while the September 26, 2023—Windows configuration update does. It also provides links to various resources for managing updates and policies.",2023-10-02T05:58:49+00:00,6bec89c1-794c-f064-2062-c20b3bdaa678,Links on CoPilot
[PatchManagement],"A vulnerability in the dynamic loader's processing of the GLIBC_TUNABLES environment variable has been discovered. This vulnerability allows for a buffer overflow and was introduced in April 2021. It has been successfully exploited, granting full root privileges on default installations of various Linux distributions. The exploit has not been published, but it is easily exploitable. Other researchers may publish working exploits shortly after this coordinated disclosure.",2023-10-04T23:40:08+00:00,2f8d46b8-77e3-945c-61c8-cc7d102223f6,Looney Tunables: Local Privilege Escalation in the glibc's ld.so (CVE-2023-4911)
[PatchManagement],The email discusses the need to update ESXI hosts to version 8 to avoid penalties. It also mentions a potential issue related to Hyper-V and provides a link for VMware.,2023-10-22T20:21:33+00:00,4af4c8b5-de7e-797a-c39f-f1af5737bbc7,October patches
[PatchManagement],The email discusses a potential issue where an admin is receiving copies of all sent emails. A link to a Reddit post about a possible Office 365 issue is provided. The issue is related to a problem with the cloud.,2023-10-17T17:54:01+00:00,51def843-da77-ca3d-30b3-d3a689c08a01,OT: If your admin is getting copies of all sent emails
[PatchManagement],"The user patched one host node of a server 22 hyper-v/starwind 2 node cluster. After reboot, one of the replicated CSVs showed as MBR in disk management, instead of GPT. The user had to nuke and re-create the corrupt CSV, restored the one lost VM from backup and it is running ok. The other node has been patched and so far things are ok. The user is hesitant to patch a second, almost identical cluster that has many more production VMs due to fear of this issue.",2023-10-18T15:33:08+00:00,93f905c3-1aa9-080b-d543-460dcf6b3a99,October patches
[PatchManagement],Discussion about the 'Windows configuration update' which is a new feature being rolled out for Windows 11 (22H2) to the Release Preview Channel. The update can be obtained by having the toggle for the latest updates turned ON via Settings.,2023-09-25T05:17:01+00:00,cfc150ea-3597-fb42-1288-857faa2844b8,Okay so what is 'Windows configuration update'?
[PatchManagement],The issue involves MS System Center pushing out patches that have already been installed on a 2012R2 server. The patches were reinstalled and are pending a reboot to finish. The user is investigating if a change or update in an application triggered this issue.,2023-10-06T16:21:18+00:00,47aa9758-5535-b1ae-4029-77047f4c6613,SCCM Pushing out previously installed patches to a server
[PatchManagement],"The issue involves Windows 10 and 11 Home devices not upgrading to 22H2. This is a change from previous behavior where Microsoft upgraded Home first, then Pro. The new policy on when Windows Home and Pro will be offered a feature update is unclear.",2023-09-27T15:15:10+00:00,2785a200-8907-677f-405c-c4d78d7d2ce6,Windows Home upgrade timeline
[PatchManagement],The SSU page ADV990001 is not up to date and it appears to be missing the 2016 SSU for September even though the page says it was updated on Sept 12th.,2023-09-21T14:41:42+00:00,ca04f859-f4e9-04f3-c9cf-95924ef68d13,Latest Server 2016 and 2019 SSU Links
[PatchManagement],The October update has an underlying issue that can affect both Hyper-V and VMware Windows 2019 and 2022 VM's. The recommendation from Microsoft is to rollback the update or forgo updating at this time.,2023-10-20T17:02:09+00:00,b5565c14-f29d-9afd-42cf-2a1489fc7989,October patches
[PatchManagement],"The registry key was never set or changed by the update; the process allowed you to add it to manually override the default setting. Now that it has entered the “full enforcement” phase with the October 10 update, the registry key is ignored.",2023-10-18T15:33:09+00:00,3ceeff60-9b44-69a0-400a-3857893fd233,October updates and Kerberos
[PatchManagement],The post discusses a solution for issues with Office. The suggested solution is to reinstall Office.,2023-09-18T12:19:12+00:00,9c0e78a8-2811-f6b4-4e11-7784d9d1c6f5,Anyone seeing issues with Office?
[PatchManagement],"The email discusses two critical vulnerabilities in WS_FTP Server, CVE-2023-40044 and CVE-2023-42657. The first vulnerability has a severity rating of 10 and allows attackers to execute malicious code with high system privileges with no authentication required. The second vulnerability has a severity rating of 9.9 and also allows for remote code execution but requires the hacker to first be authenticated to the vulnerable system.",2023-10-05T15:57:18+00:00,cfacf717-4c77-22f5-b659-6e7214a9c289,"WS_FTP exploits, 10 and 9.9"
[PatchManagement],The email discusses a Windows backup app that is installed with KB5029331. The app is considered divisive and Microsoft has stated that it cannot be removed.,2023-10-02T14:02:46+00:00,d808b32c-1dc9-33bd-4b8c-6d36f40443c3,Heads-up - Windows backup app installed with KB5029331 (and presumably next CU)
[PatchManagement],The author is concerned about the full enforcement of the Kerberos protocol settings after the October updates. They have observed that the registry keys on their domain controllers did not change as expected. They are particularly concerned about potential issues with their legacy XP systems.,2023-10-18T15:11:54+00:00,5f3825fb-b448-5d65-1924-71a029290f81,October updates and Kerberos
[PatchManagement],The email provides a tool to remove the Azure Arc Setup feature installed on Windows Server 2022. The tool is recommended to be used during out of office hours.,2023-10-14T05:35:35+00:00,c3ca8e34-d77f-5e5f-53c3-a104a6eacea0,Remove the Azure Arc Setup 'feature' installed on Windows Server 2022 – Out of Office Hours
[PatchManagement],"If you uninstall KB5002457 and have installed KB5002498 you may see an 'Ordinal Not Found' error, and the app won't start. To fix this issue completely, you must install KB5002457 together with this update.",2023-09-18T14:32:26+00:00,d158164e-f1e5-4f1a-a503-5a064e4b71e3,Anyone seeing issues with Office?
[PatchManagement],"The email discusses issues related to the October CU (KB5031362) patch on ESXi 6.5, particularly its impact on guest OS and clusters. The author seeks clarification on the affected OS versions, the frequency of the issue, and its impact on different ESXi versions. The author also mentions conflicting information about the need to delete certain files after patch installation.",2023-10-19T18:43:50+00:00,7f58f800-9b60-c769-ffa9-007b7083ca27,October patches
[PatchManagement],An auto approval rule in SCCM is used to send the updated patches out after a sync. This can also be done in stand-alone WSUS.,2023-10-02T15:47:11+00:00,ab86530f-8cea-55ce-bf7f-9f02914aa60f,CVE-2023-4863 - libwebp
[PatchManagement],"The user reports an issue with the Windows Backup app on a fully updated 22H2 W10 Pro device. The app shows variation in settings between different devices. When the user runs the backup, it shows that the folders are partially backed up, even though they were previously unselected. The user also notes that adding a new file to a folder and running the backup causes the folder to be selected for backup and the new file to be backed up. However, this action removes the ability to select individual folders in the backup app.",2023-09-18T17:21:56+00:00,c4c40fcf-30f7-150d-7b9a-8db3eb2cd8fa,Windows 10 22H2 - I am not seeing a backup app in the system tray while on a domain
[PatchManagement],"The October 2023 security update for Windows 10, version 22H2 and 21H2, might fail to install. The update initially shows progress but then fails to complete installation. The most common error encountered is Error 8007000D (ERROR_INVALID_DATA). Microsoft is investigating the issue and will provide an update when more information is available.",2023-10-13T18:54:20+00:00,7a4b659c-f196-cc39-cdc3-c056631652e9,The October 2023 security update might fail to install
[PatchManagement],"A problem has been identified where a WSUS box is not detecting the need for a patch on Windows 11 22H2 systems. The patch in question is a 'dynamic update' flagged as critical. Despite the patch being approved and set appropriately, the Windows 11 systems are reporting as 100% patched and not needing the update.",2023-10-12T16:43:45+00:00,5e4985d6-30d4-daaf-278d-32316d9ebb25,WSUS not seeing Windows 11 updates?
[PatchManagement],"The email discusses several issues related to recent Microsoft patches. These issues include the weather not being displayed on the Calendar in Outlook, images being blocked and meeting body being read only in Outlook Desktop, and Outlook blocking opening FQDN and IP address hyperlinks. These issues are a result of the Microsoft Outlook Spoofing Vulnerability released on August 8, 2023 and the Microsoft Outlook Security Feature Bypass Vulnerability released on July 11, 2023.",2023-10-11T04:37:11+00:00,cf2f5bef-f4ca-e3f3-6546-fdd089f84a81,Office changes
[PatchManagement],"After installing the October MS updates, the user's default Chrome profile is missing, including recent history and bookmarks. Another Chrome profile on the same system was unaffected. The user is seeking help on how to recover the missing profile.",2023-10-12T21:03:25+00:00,11d4eda2-6b9c-6166-7612-15e6666f2ec2,Post October Updates Missing Chrome profile
[PatchManagement],The problem involves some Windows 10 AD joined managed laptops that have been upgraded to Windows 11 Insider Preview builds. The issue seems to be a block on previous GP for Windows 11 build that expired and a policy with insider preview was enabled. The query is about the easiest path to get them onto Windows 11 stable builds. The suggested solutions are unenrolling the devices when the next version of Windows releases or a rebuild.,2023-10-19T06:16:01+00:00,655ec7d1-376a-b414-1d3b-777e95b6777c,Windows insider preview builds pushed to some laptops
[PatchManagement],"Post October 2023 Windows Explorer keeps crashing. The issue is first noticed when the taskbar freezes, then it is discovered that no folders can be opened on the desktop and an error is generated. Restarting explorer.exe temporarily restores the taskbar.",2023-10-13T23:03:47+00:00,d4540040-b4c8-045a-c249-b9c36b505c52,"Windows 11 22H2 October 2023 Updates, Explorer Keeps Crashing"
[PatchManagement],The email provides a tool that lists the features that are behind temporary control. These features are off by default when shipped in the quality update to the current version for commercial update managed devices. The tool also includes features that are under permanent control.,2023-09-27T16:08:22+00:00,290baef1-ea84-6105-e661-61ca23f64090,List of Features Behind Temporary Control
[PatchManagement],The post discusses a problem with upgrading Win11 clients running pre 22H2 to 22H2 via wsus. The author is looking for a way to permit this upgrade without applying the patch to all machines that Win11 can run on. The author is considering using Group Policy to assign separate wsus groups for each OS type as a potential solution.,2023-09-20T21:44:58+00:00,d6762949-ddbb-81e1-7f0f-b626decf99e4,Wsus and approving Win 11 21H2 -> 22H2 upgrade
[PatchManagement],The post discusses a solution to a boot manager failure issue that occurred after the August updates. It suggests that MSI BIOS updates fix the Windows unsupported processor BSOD bug.,2023-09-18T18:14:45+00:00,7ed75b9c-86af-ddec-a94c-20a2c2891928,Boot manager failure after August updates
[PatchManagement],"The user reports an issue with Windows 10 workstations where certain services, including Lanmanworkstation and Netlogon, are not starting after reboot. This is affecting productivity as users are unable to work until the services are manually started. The root cause of the issue is not yet known and the problem has only been observed on a small number of workstations.",2023-10-18T10:58:58+00:00,9faab8d0-c9b4-7f52-57ca-5f7dfb33e17f,Windows 10 - lanmanworkststion and netlogon and services not starting
[PatchManagement],The email discusses the use of Ivanti Security Controls/Shavlik for patching over 275 servers.,2023-09-25T17:47:30+00:00,c160528e-e240-ec11-3856-747e725005ee,SCCM/Configuration Manager for Servers
[PatchManagement],The email discusses a recommendation to migrate from legacy LAPS to modern Windows LAPS. It also mentions a problem in the current ADMX files documentation that will be fixed in the future.,2023-10-22T20:21:30+00:00,ab4f035d-3168-b804-c44d-b1215745e18f,Windows LAPS on-premises issue and fix
[PatchManagement],The email provides a tool to identify apps impacted by the CVE-2023-4863 vulnerability in libwebp.,2023-10-02T17:36:46+00:00,2e1f433a-1298-434c-0d21-ff6ebae03a63,CVE-2023-4863 - libwebp
[PatchManagement],"The post discusses a problem where the boot manager fails after the August updates. The author speculates whether this issue could be related to Secure Boot patches and configuration, citing a similar issue encountered in vSphere due to Secure Boot being enabled on the VMs.",2023-09-18T18:14:48+00:00,ee0c530f-fefc-b6cd-3dbc-a5bc8d2d2d3d,Boot manager failure after August updates
[PatchManagement],The email provides a solution to a problem where the admin is receiving copies of all sent emails. The solution involves accessing the Anti-Spam outbound policy in https://security.microsoft.com/antispam and unchecking the option to send a copy of suspicious outbound emails to the admin.,2023-10-17T18:18:46+00:00,f8030b23-8904-d6fd-f93a-f19c85fe948f,OT: If your admin is getting copies of all sent emails
[PatchManagement],A new tool called Copilot has been released in the optional updates. An ADMX file from a preview release/updated to 23H2 machine has been uploaded.,2023-09-27T01:01:31+00:00,fc6b9de7-c3bf-eb66-d36d-3df9b23bf2bb,Copilot released in the OPTIONAL updates today
[PatchManagement],The email discusses the transition from Lumension to SCCM for patch management. The author mentions that the actual patch deployment is easy and is done via a monthly deployment. Maintenance windows are assigned to servers for when they will patch. Desktops are also patched via SCCM.,2023-09-25T18:27:11+00:00,0b5ee655-92b7-344a-f313-698ea5c8b383,SCCM/Configuration Manager for Servers
[PatchManagement],"The email discusses the process of upgrading Windows Home. It mentions that targeting works on Home, and any remnants of these keys can cause it to fail if you're trying to remove Targeting. If it is being targeted then upgrades will not be offered. It provides registry commands for targeting Windows 10 22H2 and Windows 11, as well as commands to eliminate targeting.",2023-09-27T18:07:48+00:00,ebacaeb1-b020-0524-f2ca-46a3096649db,Windows Home upgrade timeline
[PatchManagement],The update KB5002457 is causing Outlook to display an 'Ordinal Not Found' error and the app won't start. The issue can be fixed by installing KB5002498 together with this update.,2023-09-21T21:31:02+00:00,f9ade070-2a80-00e1-a1ea-2dec50d1446a,KB5002457 - Breaking Outlook
[PatchManagement],A registry change has been used to stop the display of a notification related to Windows System Toast Backup Reminder.,2023-10-05T13:33:04+00:00,3ba40550-192f-3ff3-905c-2146e9319390,Major update from Message center
[PatchManagement],The October patches have caused a compatibility problem with previous .RCT files if they exist. Karl provides a detailed explanation and remediation for the issue.,2023-10-19T23:30:07+00:00,74b68ba3-c06f-0f9c-3e50-befdc2dd1e86,October patches
[PatchManagement],The email discusses a solution for managing updates for libwebp vulnerability CVE-2023-4863. The suggested solution involves using Chrome Enterprise to push out a GUID to each computer and centrally manage Chrome updates. It also mentions the option of using a portable version of Chrome for systems not running an AppLocker variant.,2023-10-02T15:47:27+00:00,b6f80518-60af-1aec-a440-c6cfd1fe22f2,CVE-2023-4863 - libwebp
[PatchManagement],"The email discusses a solution for upgrading Windows 10 Home to Windows 11. It mentions a script that needs to be run to delete targeting, after which Windows 11, 22H2 is detected. The solution involves setting a target to upgrade for Windows 11 Pro and removing the target for Windows 11 Home, even if it's set for the desired/future version.",2023-09-27T22:42:13+00:00,f2820d74-8c27-c0dc-3814-a7a6ae1beb5e,Windows Home upgrade timeline
[PatchManagement],"This update brings back an improved search box experience on the taskbar. If you have a top, bottom, regular, or small icons taskbar, you will see the search box appear. You can use it to easily access apps, files, settings, and more from Windows and the web. You will also have access to the latest search updates, such as search highlights. If you want to restore your previous search experience, you can do that easily. Use the taskbar shortcut menu or respond to a dialog that appears when you use search.",2023-10-12T04:37:31+00:00,a44c0815-355f-9320-40cc-c9a0c3768dcb,Microsoft stop messing with my people's task bar settings.
[PatchManagement],The email discusses a solution to remove the Azure Arc Setup feature from Windows Server 2022. The solution involves using a tool to silence and remove the feature.,2023-10-20T13:48:10+00:00,1d775e47-bd57-4e4c-c9b5-8d35b7664388,Remove the Azure Arc Setup 'feature' installed on Windows Server 2022 – Out of Office Hours
